year,title,citations
04,"Paragraph-, Word-, and Coherence-based Approaches to Sentence Ranking: A Comparison of Algorithm and Human Performance",3
04,Evaluating Centering-Based Metrics of Coherence,16
04,Computing Locally Coherent Discourses,16
04,Generating Referring Expressions in Open Domains,27
04,Discovering Relations among Named Entities from Large Corpora,107
04,Dependency Tree Kernels for Relation Extraction,201
04,Classifying Semantic Relations in Bioscience Texts,47
04,Collective Information Extraction with Relational Markov Networks,54
04,Error Mining for Wide-Coverage Grammar Engineering,30
04,Alternative approaches for Generating Bodies of Grammar Rules,7
04,Adaptive Chinese Word Segmentation,27
04,Experiments in parallel-text based grammar induction,22
04,Corpus-Based Induction of Syntactic Structure: Models of Dependency and Constituency,113
04,Annealing Techniques For Unsupervised Statistical Language Learning,17
04,Multi-Engine Machine Translation with Voted Language Model,19
04,Aligning words using matrix factorisation,16
04,FSA: An Efficient and Flexible C++ Toolkit for Finite State Automata Using On-Demand Computation,25
04,Improving IBM Word Alignment Model 1,24
04,A Geometric View on Bilingual Lexicon Extraction from Comparable Corpora,20
04,Creating Multilingual Translation Lexicons with Regional Variations Using Web Corpora,10
04,Probabilistic Parsing Strategies,4
04,An Alternative Method of Training Probabilistic LR Parsers,3
04,Wrapping of Trees,0
04,Splitting Complex Temporal Questions for Question Answering Systems,14
04,Question Answering Using Constraint Satisfaction: QA-By-Dossier-With-Contraints,19
04,Applying Machine Learning to Chinese Temporal Relation Resolution,15
04,Multi-Criteria-based Active Learning for Named Entity Recognition,40
04,Weakly Supervised Learning for Cross-document Person Name Disambiguation Supported by Information Extraction,19
04,Automatic Evaluation of Machine Translation Quality Using Longest Common Subsequence and Skip-Bigram Statistics,72
04,A Unified Framework For Automatic Evaluation Using 4-Gram Co-occurrence Statistics,406
04,Extending the BLEU MT Evaluation Method with Frequency Weightings,35
04,Learning Word Sense With Feature Selection and Order Identification Capabilities,3
04,A Kernel PCA Method for Superior Word Sense Disambiguation,6
04,Using Linguistic Principles to Recover Empty Categories,14
04,Statistical Machine Translation by Parsing,0
04,Generalized Multitext Grammars,34
04,Identifying Agreement and Disagreement in Conversational Speech: Use of Bayesian Networks to Model Pragmatic Dependencies,55
04,Using Conditional Random Fields to Predict Pitch Accents in Conversational Speech,22
04,Acquiring the Meaning of Discourse Markers,11
04,FLSA: Extending Latent Semantic Analysis with Features for Dialogue Act Classification,26
04,Front Matter,1
04,Determining the Specificity of Terms using Compositional and Contextual Information,3
04,Minimizing the Length of Non-Mixed Initiative Dialogs,2
04,Searching for Topics in a Large Collection of Texts,0
04,Temporal Context: Applications and Implications for Computational Linguistics,0
04,Automatic Acquisition of English Topic Signatures Based on a Second Language,0
04,iSTART: Paraphrase Recognition,0
04,Towards a Semantic Classification of Spanish Verbs Based on Subcategorisation Information,5
04,Improving the Accuracy of Subcategorizations Acquired from Corpora,1
04,Robust VPE Detection using Automatically Parsed Text,0
04,A Machine Learning Approach to German Pronoun Resolution,4
04,Beyond N in N-gram Tagging,150
04,A Framework for Unsupervised Natural Language Morphology Induction,7
04,Front Matter,1
04,TransType2 - An Innovative Computer-Assisted Translation System,6
04,Improving Domain-Specific Word Alignment for Computer Assisted Translation,1
04,Constructing Transliteration Lexicons from Web Corpora,5
04,Subsentential Translation Memory for Computer Assisted Writing and Translation,2
04,Customizing Parallel Corpora at the Document Level,0
04,An Automatic Filter for Non-Parallel Texts,65
04,Exploiting Aggregate Properties of Bilingual Dictionaries For Distinguishing Senses of English Words and Inducing English Sense Clusters,0
04,Interactive grammar development with WCDG,3
04,Wide Coverage Symbolic Surface Realization,22
04,Part-of-Speech Tagging Considering Surface Form for an Agglutinative Language,1
04,Is Conceptual Combination Influenced by Word Order?,3
04,Corpus representativeness for syntactic information acquisition,1
04,Exploiting Unannotated Corpora for Tagging and Chunking,6
04,Improving Bitext Word Alignments via Syntax-based Reordering of English,2
04,Hierarchy Extraction based on Inclusion of Appearance,5
04,Knowledge intensive e-mail summarization in CARPANTA,0
04,Finding Anchor Verbs for Biomedical IE Using Predicate-Argument Structures,4
04,Resource Analysis for Question Answering,14
04,TANGO: Bilingual Collocational Concordancer ,5
04,"Graph-based Ranking Algorithms for Sentence Extraction, Applied to Text Summarization",62
04,Compiling Boostexter Rules into a Finite-state Transducer,0
04,"Combining Lexical, Syntactic, and Semantic Features with Maximum Entropy Models for Information Extraction",0
04,On the Equivalence of Weighted Finite-state Transducers,1
04,A New Feature Selection Score for Multinomial Naive Bayes Text Classification Based on KL-Divergence,9
04,Incorporating topic information into semantic analysis models,6
04,A Practical Solution to the Problem of Automatic Word Sense Induction,4
04,Automatic clustering of collocation for detecting practical sense boundary,1
04,Co-training for Predicting Emotions with Spoken Dialogue Data,14
04,Multimodal Database Access on Handheld Devices,1
04,Wysiwym with wider coverage,1
04,NLTK: The Natural Language Toolkit,9
04,Dyna: A Language for Weighted Dynamic Programming,19
04,MATCHkiosk: A Multimodal Interactive City Guide,7
04,Fragments and Text Categorization,1
05,Front Matter,1
05,A High-Performance Semi-Supervised Learning Method for Text Chunking,51
05,Scaling Conditional Random Fields Using Error-Correcting Codes,13
05,Logarithmic Opinion Pools for Conditional Random Fields,21
05,Supersense Tagging of Unknown Nouns Using Semantic Similarity,17
05,Learning Semantic Classes for Word Sense Disambiguation,36
05,The Role of Semantic Roles in Disambiguating Verb Senses,13
05,Aggregation Improves Learning: Experiments in Natural Language Generation for Intelligent Tutoring Systems,13
05,Empirically-based Control of Natural Language Generation,12
05,Towards Developing Generation Algorithms for Text-to-Text Applications,8
05,Probabilistic CFG with Latent Annotations,56
05,Probabilistic Disambiguation Models for Wide-Coverage HPSG Parsing,49
05,Online Large-Margin Training of Dependency Parsers,171
05,Pseudo-Projective Dependency Parsing,91
05,The Distributional Inclusion Hypotheses and Lexical Entailment,31
05,Seeing Stars: Exploiting Class Relationships for Sentiment Categorization with Respect to Rating Scales,141
05,Inducing Ontological Co-occurrence Vectors,10
05,Extracting Semantic Orientations of Words using Spin Model,47
05,Modeling Local Coherence: An Entity-Based Approach,69
05,Modelling the Substitutability of Discourse Connectives,3
05,Machine Learning for Coreference Resolution: From Local Classification to Global Ranking,28
05,Improving Pronoun Resolution Using Statistics-Based Semantic Compatibility Information,16
05,Coarse-to-Fine n-Best Parsing and MaxEnt Discriminative Reranking,219
05,Data-Defined Kernels for Parse Reranking Derived from Probabilistic Models,13
05,Boosting-based Parse Reranking with Subtree Features,19
05,Automatic Measurement of Syntactic Development in Child Language,14
05,Experiments with Interactive Question-Answering,27
05,Question Answering as Question-Biased Term Extraction: A New Approach toward Multilingual QA,9
05,Exploring and Exploiting the Limited Utility of Captions in Recognizing Intention in Information Graphics,12
05,Scaling up from Dialogue to Multilogue: Some Principles and Benchmarks,3
05,Implications for Generating Clarification Requests in Task-Oriented Dialogues,12
05,Scaling Phrase-Based Statistical Machine Translation to Larger Corpora and Longer Phrases,24
05,A Hierarchical Phrase-Based Model for Statistical Machine Translation,290
05,Dependency Treelet Translation: Syntactically Informed Phrasal SMT,134
05,QARLA: A Framework for the Evaluation of Text Summarization Systems,10
05,Supervised and Unsupervised Learning for Sentence Compression,39
05,Lexicalization in Crosslinguistic Probabilistic Parsing: The Case of French,18
05,What to Do When Lexicalization Fails: Parsing German with Suffix Analysis and Smoothing,20
05,Detecting Errors in Discontinuous Structural Annotation,16
05,A Dynamic Bayesian Framework to Model Context and Memory in Edit Distance Learning: An Application to Pronunciation Classification,13
05,Learning Stochastic OT Grammars: A Bayesian Approach using Data Augmentation and Gibbs Sampling,3
05,Contrastive Estimation: Training Log-Linear Models on Unlabeled Data,69
05,Incorporating Non-local Information into Information Extraction Systems by Gibbs Sampling,174
05,Unsupervised Learning of Field Segmentation Models for Information Extraction,34
05,A Semantic Approach to IE Pattern Induction,41
05,Word Sense Disambiguation vs. Statistical Machine Translation,35
05,Word Sense Disambiguation Using Label Propagation Based Semi-Supervised Learning,32
05,Domain Kernels for Word Sense Disambiguation,40
05,Improving Name Tagging by Reference Resolution and Relation Detection,21
05,Extracting Relations with Integrated Information Using Kernel Methods,77
05,Exploring Various Knowledge in Relation Extraction,60
05,A Quantitative Analysis of Lexical Differences Between Genders in Telephone Conversations,5
05,Position Specific Posterior Lattices for Indexing Speech,37
05,Using Conditional Random Fields for Sentence Boundary Detection in Speech,25
05,Log-Linear Models for Word Alignment,34
05,Alignment Model Adaptation for Domain-Specific Word Alignment,4
05,Stochastic Lexicalized Inversion Transduction Grammar for Alignment,30
05,Multi-Field Information Extraction and Cross-Document Fusion,21
05,Simple Algorithms for Complex Relation Extraction with Applications to Biomedical IE,18
05,Resume Information Extraction with Cascaded Hybrid Model,16
05,Discriminative Syntactic Language Modeling for Speech Recognition,25
05,A Phonotactic Language Model for Spoken Language Identification,12
05,Reading Level Assessment Using Support Vector Machines and Statistical Language Models,36
05,Clause Restructuring for Statistical Machine Translation,115
05,Machine Translation Using Probabilistic Synchronous Dependency Insertion Grammars,73
05,Context-Dependent SMT Model using Bilingual Verb-Noun Collocation,1
05,A Localized Prediction Model for Statistical Machine Translation,33
05,Instance-based Sentence Boundary Determination by Optimization for Natural Language Generation,2
05,"Arabic Tokenization, Part-of-Speech Tagging and Morphological Disambiguation in One Fell Swoop",84
05,Semantic Role Labeling Using Different Syntactic Views,47
05,Joint Learning Improves Semantic Role Labeling,65
05,Paraphrasing with Bilingual Parallel Corpora,60
05,A Nonparametric Method for Extraction of Candidate Phrasal Terms,15
05,Automatic Acquisition of Adjectival Subcategorization from Corpora,6
05,Randomized Algorithms and NLP: Using Locality Sensitive Hash Functions for High Speed Noun Clustering,27
05,Front Matter,1
05,Hybrid Methods for POS Guessing of Chinese Unknown Words,4
05,An Extensive Empirical Study of Collocation Extraction Methods,8
05,Jointly Labeling Multiple Sequences: A Factorial HMM Approach,2
05,Exploiting Named Entity Taggers in a Second Language,2
05,Automatic Discovery of Intentions in Text and its Application to Question Answering,1
05,American Sign Language Generation: Multimodal NLG with Multiple Linguistic Channels,11
05,Using Emoticons to Reduce Dependency in Machine Learning Techniques for Sentiment Classification,29
05,Learning Meronyms from Biomedical Text,1
05,Using Readers to Identify Lexical Cohesive Structures in Texts,5
05,Towards an Optimal Lexicalization in a Natural-Sounding Portable Natural Language Generator for Dialog Systems,0
05,Phrase Linguistic Classification and Generalization for Improving Statistical Machine Translation,6
05,Automatic Induction of a CCG Grammar for Turkish,5
05,Dialogue Act Tagging for Instant Messaging Chat Sessions,11
05,Learning Strategies for Open-Domain Natural Language Question Answering,1
05,Dependency-Based Statistical Machine Translation,1
05,Minimalist Parsing of Subjects Displaced from Embedded Clauses in Free Word Order Languages,0
05,Centrality Measures in Text Mining: Prediction of Noun Phrases that Appear in Abstracts,1
05,A Corpus-Based Approach to Topic in Danish dialog,3
05,Learning Information Structure in the Prague Treebank,2
05,Using Bilingual Dependencies to Align Words in English/French Parallel Corpora,0
05,An Unsupervised System for Identifying English Inclusions in German Text,4
05,Corpus-Oriented Development of Japanese HPSG Parsers,0
05,Unsupervised Discrimination and Labeling of Ambiguous Names,4
05,A Domain-Specific Statistical Surface Realizer,0
05,Front Matter,1
05,An Information-State Approach to Collaborative Reference,7
05,Accessing GermaNet Data and Computing Semantic Relatedness,4
05,Efficient Solving and Exploration of Scope Ambiguities,6
05,Dynamically Generating a Protein Entity Dictionary Using Online Resources,0
05,Descriptive Question Answering in Encyclopedia,2
05,High Throughput Modularized NLP System for Clinical Text,4
05,A Voice Enabled Procedure Browser for the International Space Station,8
05,Learning Source-Target Surface Patterns for Web-based Terminology Translation,11
05,SPEECH OGLE: Indexing Uncertainty for Spoken Document Search,2
05,Multimodal Generation in the COMIC Dialogue System,10
05,Language Independent Extractive Summarization,18
05,SenseLearner: Word Sense Disambiguation for All Words in Unrestricted Text,10
05,Syntax-based Semi-Supervised Named Entity Tagging,3
05,Portable Translator Capable of Recognizing Characters on Signboard and Menu Captured by its Built-in Camera,6
05,Supporting Annotation Layers for Natural Language Processing,3
05,Word Alignment and Cross-Lingual Resource Acquisition,2
05,A Practical Solution to the Problem of Automatic Part-of-Speech Induction from Text,5
05,Automating Temporal Annotation with TARSQI,25
05,Two Diverse Systems Built using Generic Components for Spoken Dialogue (Recent Progress on TRIPS),8
05,Transonics: A Practical Speech-to-Speech Translator for English-Farsi Medical Dialogs,5
05,The Wild Thing,8
05,Interactively Exploring a Machine Translation Model,8
05,Multi-Engine Machine Translation Guided by Explicit Word Matching,39
05,SenseClusters: Unsupervised Clustering and Labeling of Similar Contexts,9
05,A Flexible Stand-Off Data Model with Query Language for Multi-Level Annotation,2
05,HAHAcronym: A Computational Humor System,5
05,Organizing English Reading Materials for Vocabulary Learning,0
05,Reformatting Web Documents via Header Trees,1
06,Combination of Arabic Preprocessing Schemes for Statistical Machine Translation,19
06,Going Beyond AER: An Extensive Analysis of Word Alignments and Their Impact on MT,29
06,Unsupervised Topic Modelling for Multi-Party Spoken Discourse,30
06,Minimum Cut Model for Spoken Lecture Segmentation,47
06,Bootstrapping Path-Based Pronoun Resolution,11
06,Kernel-Based Pronoun Resolution with Structured Syntactic Knowledge,14
06,A Finite-State Model of Human Sentence Processing,4
06,Acceptability Prediction by Means of Grammaticality Quantification,5
06,Discriminative Word Alignment with Conditional Random Fields,32
06,Named Entity Transliteration with Comparable Corpora,31
06,Extracting Parallel Sub-Sentential Fragments from Non-Parallel Corpora,18
06,Estimating Class Priors in Domain Adaptation for Word Sense Disambiguation,10
06,Ensemble Methods for Unsupervised WSD,23
06,Meaningful Clustering of Senses Helps Boost Word Sense Disambiguation Performance,27
06,Espresso: Leveraging Generic Patterns for Automatically Harvesting Semantic Relations,131
06,Modeling Commonality among Related Classes in Relation Extraction,9
06,Relation Extraction Using Label Propagation Based Semi-Supervised Learning,19
06,Polarized Unification Grammars,10
06,Partially Specified Signatures: A Vehicle for Grammar Modularity,5
06,Morphology-Syntax Interface for Turkish LFG,1
06,PCFGs with Syntactic and Prosodic Indicators of Speech Repairs,10
06,Dependency Parsing of Japanese Spoken Monologue Based on Clause Boundaries,0
06,Trace Prediction and Recovery with Unlexicalized PCFGs and Slash Features,7
06,Learning More Effective Dialogue Strategies Using Limited Dialogue Move Features,21
06,Dependencies between Student State and Speech Recognition Problems in Spoken Tutoring Dialogues,5
06,Learning the Structure of Task-Driven Human-Human Dialogs,18
06,Semi-Supervised Conditional Random Fields for Improved Sequence Segmentation and Labeling,34
06,Training Conditional Random Fields with Multivariate Evaluation Measures,9
06,Approximation Lasso Methods for Language Modeling,6
06,Automated Japanese Essay Scoring System based on Articles Written by Experts,4
06,A Feedback-Augmented Method for Detecting Errors in the Writing of Learners of English,10
06,Correcting ESL Errors Using Phrasal SMT Techniques,16
06,Graph Transformations in Data-Driven Dependency Parsing,11
06,Learning to Generate Naturalistic Utterances Using Reviews in Spoken Dialogue Systems,12
06,Measuring Language Divergence by Intra-Lexical Comparison,14
06,Enhancing Electronic Dictionaries with an Index Based on Associations,12
06,Guiding a Constraint Dependency Parser with Supertags,6
06,Efficient Unsupervised Discovery of Word Categories Using Symmetric Patterns and High Frequency Words,21
06,Bayesian Query-Focused Summarization,26
06,Expressing Implicit Semantic Relations without Supervision,40
06,Hybrid Parsing: Using Probabilistic Models as Predictors for a Symbolic Parser,19
06,Error Mining in Parsing Results,7
06,Reranking and Self-Training for Parser Adaptation,48
06,Automatic Classification of Verbs in Biomedical Texts,9
06,Selection of Effective Contextual Information for Automatic Synonym Acquisition,9
06,Scaling Distributional Similarity to Large Corpora,16
06,Extractive Summarization using Inter- and Intra- Event Relevance,23
06,"Models for Sentence Compression: A Comparison across Domains, Training Requirements and Evaluation Measures",25
06,A Bottom-Up Approach to Sentence Ordering for Multi-Document Summarization,12
06,Learning Event Durations from Event Descriptions,10
06,Automatic Learning of Textual Entailments with Cross-Pair Similarities,14
06,An Improved Redundancy Elimination Algorithm for Underspecified Representations,5
06,"Integrating Syntactic Priming into an Incremental Probabilistic Parser, with an Application to Psycholinguistic Modeling",6
06,"A Fast, Accurate Deterministic Parser for Chinese",9
06,"Learning Accurate, Compact, and Interpretable Tree Annotation",79
06,Semi-Supervised Learning of Partial Cognates Using Bilingual Bootstrapping,4
06,Direct Word Sense Matching for Lexical Substitution,17
06,An Equivalent Pseudoword Solution to Chinese Word Sense Disambiguation,1
06,Improving the Scalability of Semi-Markov Conditional Random Fields for Named Entity Recognition,23
06,Factorizing Complex Models: A Case Study in Mention Detection,6
06,Segment-Based Hidden Markov Models for Information Extraction,0
06,A DOM Tree Alignment Model for Mining Parallel Data from the Web,12
06,QuestionBank: Creating a Corpus of Parse-Annotated Questions,3
06,Creating a CCGbank and a Wide-Coverage CCG Lexicon for German,10
06,Improved Discriminative Bilingual Word Alignment,15
06,Maximum Entropy Based Phrase Reordering Model for Statistical Machine Translation,58
06,Distortion Models for Statistical Machine Translation,33
06,A Study on Automatically Extracted Keywords in Text Categorization,18
06,A Comparison and Semi-Quantitative Analysis of Words and Character-Bigrams as Features in Chinese Text Categorization,9
06,Exploiting Comparable Corpora and Bilingual Dictionaries for Cross-Language Text Categorization,12
06,A Progressive Feature Selection Algorithm for Ultra Large Feature Spaces,1
06,Annealing Structural Bias in Multilingual Weighted Grammar Induction,25
06,Maximum Entropy Based Restoration of Arabic Diacritics,20
06,An Iterative Implicit Feedback Approach to Personalized Search,11
06,The Effect of Translation Quality in MT-Based Cross-Language Information Retrieval,8
06,"A Comparison of Document, Sentence, and Term Event Spaces",6
06,Tree-to-String Alignment Template for Statistical Machine Translation,81
06,Incorporating Speech Recognition Confidence into Discriminative Named Entity Recognition of Speech Data,4
06,Exploiting Syntactic Patterns as Clues in Zero-Anaphora Resolution,15
06,Self-Organizing n-gram Model for Automatic Word Spacing,1
06,Concept Unification of Terms in Different Languages for IR,2
06,Word Alignment in English-Hindi Parallel Corpus Using Recency-Vector Approach: Some Studies,1
06,Extracting Loanwords from Mongolian Corpora and Producing a Japanese-Mongolian Bilingual Dictionary,5
06,An Unsupervised Morpheme-Based HMM for Hebrew Morphological Disambiguation,12
06,Contextual Dependencies in Unsupervised Word Segmentation,54
06,MAGEAD: A Morphological Analyzer and Generator for the Arabic Dialects,9
06,Noun Phrase Chunking in Hebrew: Influence of Lexical and Morphological Features,6
06,Multi-Tagging for Lexicalized-Grammar Parsing,18
06,Guessing Parts-of-Speech of Unknown Words Using Global Information,6
06,A Clustered Global Phrase Reordering Model for Statistical Machine Translation,12
06,A Discriminative Global Training Algorithm for Statistical MT,23
06,Phoneme-to-Text Transcription System with an Infinite Vocabulary,0
06,Automatic Generation of Domain Models for Call-Centers from Noisy Transcriptions,19
06,Proximity in Context: An Empirically Grounded Computational Model of Proximity for Processing Topological Spatial Expressions,10
06,Machine Learning of Temporal Relations,44
06,An End-to-End Discriminative Approach to Machine Translation,41
06,Semi-Supervised Training for Statistical Word Alignment,33
06,Left-to-Right Target Generation for Hierarchical Phrase-Based Translation,15
06,Ontologizing Semantic Relations,16
06,Semantic Taxonomy Induction from Heterogenous Evidence,108
06,Names and Similarities on the Web: Fact Extraction in the Fast Lane,32
06,Weakly Supervised Named Entity Transliteration and Discovery from Multilingual Comparable Corpora,27
06,A Composite Kernel to Extract Relations between Entities with Both Flat and Structured Features,45
06,Japanese Dependency Parsing Using Co-Occurrence Information and a Combination of Case Elements,4
06,"Answer Extraction, Semantic Clustering, and Extractive Summarization for Clinical Question Answering",12
06,Discovering Asymmetric Entailment Relations between Verbs Using Selectional Preferences,11
06,Event Extraction in a Plot Advice Agent,2
06,An All-Subtrees Approach to Unsupervised Parsing,28
06,Advances in Discriminative Parsing,14
06,Prototype-Driven Grammar Induction,8
06,Exploring Correlation of Dependency Relation Paths for Answer Extraction,14
06,Question Answering with Lexical Chains Propagating Verb Arguments,11
06,Methods for Using Textual Entailment in Open-Domain Question Answering,48
06,Using String-Kernels for Learning Semantic Parsers,35
06,A Bootstrapping Approach to Unsupervised Detection of Cue Phrase Variants,7
06,"Semantic Role Labeling via FrameNet, VerbNet and PropBank",25
06,Multilingual Legal Terminology on the Jibiki Platform: The LexALP Project,2
06,Leveraging Reusability: Cost-Effective Lexical Acquisition for Large-Scale Ontology Translation,6
06,Accurate Collocation Extraction Using a Multilingual Parser,9
06,Scalable Inference and Training of Context-Rich Syntactic Translation Models,128
06,Modelling Lexical Redundancy for Machine Translation,7
06,Empirical Lower Bounds on the Complexity of Translational Equivalence,25
06,A Hierarchical Bayesian Language Model Based On Pitman-Yor Processes,53
06,A Phonetic-Based Approach to Chinese Chat Text Normalization,1
06,Discriminative Pruning of Language Models for Chinese Word Segmentation,1
06,Novel Association Measures Using Web Search with Double Checking,45
06,Semantic Retrieval for the Accurate Identification of Relational Concepts in Massive Textbases,31
06,Exploring Distributional Similarity Based Models for Query Spelling Correction,27
06,Robust PCFG-Based Generation Using Automatically Acquired LFG Approximations,14
06,Incremental Generation of Spatial Referring Expressions in Situated Dialog,23
06,Learning to Predict Case Markers in Japanese,8
06,Are These Documents Written from Different Perspectives? A Test of Different Perspectives Based on Statistical Distribution Divergence,9
06,Word Sense and Subjectivity,42
06,Improving QA Accuracy by Question Inversion,1
06,Reranking Answers for Definitional QA Using Language Modeling,10
06,Highly Constrained Unification Grammars,3
06,"A Polynomial Parsing Algorithm for the Topological Model: Synchronizing Constituent and Dependency Grammars, Illustrated by German Word Order Phenomena",0
06,Stochastic Language Generation Using WIDL-Expressions and its Application in Machine Translation and Summarization,4
