year,title,citations
07,Measuring Importance and Query Relevance in Topic-focused Multi-document Summarization,9
07,Expanding Indonesian-Japanese Small Translation Dictionary Using a Pivot Language,0
07,Shallow Dependency Labeling,0
07,Minimally Lexicalized Dependency Parsing,0
07,Extending MARIE: an N-gram-based SMT decoder,4
07,A Hybrid Approach to Word Segmentation and POS Tagging,11
07,Automatic Part-of-Speech Tagging for Bengali: An Approach for Morphologically Rich Languages in a Poor Resource Scenario,4
07,Japanese Dependency Parsing Using Sequential Labeling for Semi-spoken Language,0
07,Measuring Syntactic Difference in British English,3
07,Inducing Combinatory Categorial Grammars with Genetic Algorithms,0
07,An Implementation of Combined Partial Parser and Morphosyntactic Disambiguator,1
07,A Practical Classification of Multiword Expressions,2
07,Automatic Prediction of Cognate Orthography Using Support Vector Machines,1
07,Exploiting Structure for Event Discovery Using the MDI Algorithm,2
07,Kinds of Features for Chinese Opinionated Information Retrieval,0
07,Limitations of Current Grammar Induction Algorithms,4
07,Logistic Online Learning Methods and Their Application to Incremental Dependency Parsing,0
07,Adaptive String Distance Measures for Bilingual Dialect Lexicon Induction,2
07,Identifying Linguistic Structure in a Quantitative Analysis of Dialect Pronunciation,1
07,Towards a Computational Treatment of Superlatives,0
07,Annotating and Learning Compound Noun Semantics,0
07,Semantic Classification of Noun Phrases Using Web Counts and Learning Algorithms,2
07,Computing Lexical Chains with Graph Clustering,2
07,Clustering Hungarian Verbs on the Basis of Complementation Patterns,2
08,Mining Wiki Resources for Multilingual Named Entity Recognition,18
08,Distributional Identification of Non-Referential Pronouns,12
08,Weakly-Supervised Acquisition of Open-Domain Classes and Class Attributes from Web Documents and Query Logs,21
08,The Tradeoffs Between Open and Traditional Relation Extraction,37
08,PDT 2.0 Requirements on a Query Language,1
08,Task-oriented Evaluation of Syntactic Parsers and Their Representations,13
08,MAXSIM: A Maximum Similarity Metric for Machine Translation Evaluation,8
08,Contradictions and Justifications: Extensions to the Textual Entailment Task,5
08,Cohesive Phrase-Based Decoding for Statistical Machine Translation,8
08,Phrase Table Training for Precision and Recall: What Makes a Good Phrase and a Good Phrase Pair?,3
08,Measure Word Generation for English-Chinese SMT Systems,1
08,Bayesian Learning of Non-Compositional Phrases with Synchronous Parsing,15
08,Applying a Grammar-Based Language Model to a Simplified Broadcast-News Transcription Task,0
08,Automatic Editing in a Back-End Speech-to-Text System,0
08,Grounded Language Modeling for Automatic Speech Recognition of Sports Video,5
08,Lexicalized Phonotactic Word Segmentation,4
08,A Re-examination of Query Expansion Using Lexical Resources,8
08,Selecting Query Term Alternations for Web Search by Exploiting Query Contexts,1
08,Searching Questions by Identifying Question Topic and Question Focus,14
08,Trainable Generation of Big-Five Personality Styles through Data-Driven Parameter Estimation,7
08,Correcting Misuse of Verb Forms,2
08,Hypertagging: Supertagging for Surface Realization with CCG,3
08,Forest-Based Translation,28
08,A Discriminative Latent Variable Model for Statistical Machine Translation,29
08,Efficient Multi-Pass Decoding for Synchronous Context Free Grammars,10
08,Regular Tree Grammars as a Formalism for Scope Underspecification,5
08,Classification of Semantic Relationships between Nominals Using Pattern Clusters,18
08,Vector-based Models of Semantic Composition,31
08,Exploiting Feature Hierarchy for Transfer Learning in Named Entity Recognition,11
08,Refining Event Extraction through Cross-Document Inference,7
08,Learning Document-Level Semantic Properties from Free-Text Annotations,21
08,Automatic Image Annotation Using Auxiliary Text Information,10
08,Hedge Classification in Biomedical Texts with a Weakly Supervised Selection of Keywords,14
08,When Specialists and Generalists Work Together: Overcoming Domain Dependence in Sentiment Tagging,22
08,A Generic Sentence Trimmer with CRFs,2
08,A Joint Model of Text and Aspect Ratings for Sentiment Summarization,38
08,Improving Parsing and PP Attachment Performance with Sense Information,9
08,A Logical Basis for the D Combinator and Normal Form in CCG,1
08,Parsing Noun Phrase Structure with CCG,2
08,Sentence Simplification for Semantic Role Labeling,9
08,Summarizing Emails with Conversational Cohesion and Subjectivity,8
08,Ad Hoc Treebank Structures,5
08,A Single Generative Model for Joint Morphological Segmentation and Syntactic Parsing,2
08,"Which Words Are Hard to Recognize? Prosodic, Lexical, and Disfluency Factors that Increase ASR Error Rates",2
08,Name Translation in Statistical Machine Translation - Learning When to Transliterate,19
08,Using Adaptor Grammars to Identify Synergies in the Unsupervised Acquisition of Linguistic Structure,3
08,Inducing Gazetteers for Named Entity Recognition by Large-Scale Clustering of Dependency Relations,12
08,Evaluating Roget's Thesauri,7
08,Unsupervised Translation Induction for Chinese Abbreviations using Monolingual Corpora,5
08,Which Are the Best Features for Automatic Verb Classification,3
08,Collecting a Why-Question Corpus for Development and Evaluation of an Automatic QA-System,3
08,Solving Relational Similarity Problems Using the Web as a Corpus,14
08,Combining Speech Retrieval Results with Generalized Additive Models,2
08,A Critical Reassessment of Evaluation Baselines for Speech Summarization,9
08,Intensional Summaries as Cooperative Responses in Dialogue: Automation and Evaluation,5
08,Word Clustering and Word Selection Based Feature Reduction for MaxEnt Based Hindi NER,0
08,Combining EM Training and the MDL Principle for an Automatic Verb Classification Incorporating Selectional Preferences,6
08,Randomized Language Models via Perfect Hash Functions,13
08,Applying Morphology Generation Models to Machine Translation,8
08,Multilingual Harvesting of Cross-Cultural Stereotypes,3
08,Semi-Supervised Convex Training for Dependency Parsing,6
08,Chinese-English Backward Transliteration Assisted with Mining Monolingual Web Pages,3
08,Robustness and Generalization of Role Sets: PropBank vs. VerbNet,2
08,A Tree Sequence Alignment-based Tree-to-Tree Translation Model,16
08,Automatic Syllabification with Structured SVMs for Letter-to-Phoneme Conversion,9
08,A New String-to-Dependency Machine Translation Algorithm with a Target Dependency Language Model,46
08,Forest Reranking: Discriminative Parsing with Non-Local Features,42
08,Simple Semi-supervised Dependency Parsing,36
08,Optimal $k$-arization of Synchronous Tree-Adjoining Grammar,4
08,Enhancing Performance of Lexicalised Grammars,0
08,Assessing Dialog System User Simulation Evaluation Measures Using Human Judges,3
08,Robust Dialog Management with N-Best Hypotheses Using Dialog Examples and Agenda,3
08,Learning Effective Multimodal Dialogue Strategies from Wizard-of-Oz Data: Bootstrapping and Evaluation,15
08,Phrase Chunking Using Entropy Guided Transformation Learning,13
08,Learning Bigrams from Unigrams,0
08,Semi-Supervised Sequential Labeling and Segmentation Using Giga-Word Scale Unlabeled Data,16
08,Large Scale Acquisition of Paraphrases for Learning Surface Patterns,15
08,Contextual Preferences,9
08,Unsupervised Discovery of Generic Relationships Using Pattern Clusters and its Evaluation by Automatically Generated SAT Analogy Questions,14
08,Improving Search Results Quality by Customizing Summary Lengths,9
08,Using Conditional Random Fields to Extract Contexts and Answers of Questions from Online Forums,12
08,Learning to Rank Answers on Large Online QA Collections,19
08,Unsupervised Lexicon-Based Resolution of Unknown Words for Full Morphological Analysis,4
08,Unsupervised Multilingual Learning for Morphological Segmentation,23
08,EM Can Find Pretty Good HMM POS-Taggers (When Given a Good Start),11
08,Distributed Word Clustering for Large Scale Class-Based Language Modeling in Machine Translation,6
08,Enriching Morphologically Poor Languages for Statistical Machine Translation,9
08,Learning Bilingual Lexicons from Monolingual Corpora,19
08,Pivot Approach for Extracting Paraphrase Patterns from Bilingual Corpora,12
08,Unsupervised Learning of Narrative Event Chains,16
08,Semantic Role Labeling Systems for Arabic using Kernel Methods,1
08,An Unsupervised Approach to Biography Production Using Wikipedia,13
08,Generating Impact-Based Summaries for Scientific Literature,6
08,Can You Summarize This? Identifying Correlates of Input Difficulty for Multi-Document Summarization,5
08,You Talking to Me? A Corpus and Algorithm for Conversation Disentanglement,7
08,An Entity-Mention Model for Coreference Resolution with Inductive Logic Programming,16
08,Gestural Cohesion for Topic Segmentation,0
08,Multi-Task Active Learning for Linguistic Annotations,6
08,Generalized Expectation Criteria for Semi-Supervised Learning of Conditional Random Fields,24
08,Analyzing the Errors of Unsupervised Learning,8
08,Joint Word Segmentation and POS Tagging Using a Single Perceptron,1
08,A Cascaded Linear Model for Joint Chinese Word Segmentation and Part-of-Speech Tagging,9
08,Joint Processing and Discriminative Training for Letter-to-Phoneme Conversion,11
08,A Probabilistic Model for Fine-Grained Expert Search,3
08,Credibility Improves Topical Blog Post Retrieval,24
08,Linguistically Motivated Features for Enhanced Back-of-the-Book Indexing,0
08,Resolving Personal Names in Email Using Context Expansion,6
08,Integrating Graph-Based and Transition-Based Dependency Parsers,34
08,"Efficient, Feature-based, Conditional Random Field Parsing",24
08,A Deductive Approach to Dependency Parsing,4
08,Evaluating a Crosslinguistic Grammar Resource: A Case Study of Wambaya,3
08,Better Alignments = Better Translations?,9
08,Mining Parenthetical Translations from the Web by Word Alignment,16
08,Soft Syntactic Constraints for Hierarchical Phrased-Based Translation,22
08,Generalizing Word Lattice Translation,38
08,Combining Multiple Resources to Improve SMT-based Paraphrasing Model,4
08,Extraction of Entailed Semantic Relations Through Syntax-Based Comma Resolution,4
08,Finding Contradictions in Text,24
08,Semantic Class Learning from the Web with Hyponym Pattern Linkage Graphs,22
08,Language Dynamics and Capitalization using Maximum Entropy,2
08,Surprising Parser Actions and Reading Difficulty,2
08,Improving the Performance of the Random Walk Model for Answering Complex Questions,5
08,Dimensions of Subjectivity in Natural Language,2
08,Extractive Summaries for Educational Science Content,0
08,Dialect Classification for Online Podcasts Fusing Acoustic and Language Based Structural and Semantic Information,2
08,The Complexity of Phrase Alignment Problems,11
08,Novel Semantic Features for Verb Sense Disambiguation,4
08,Icelandic Data Driven Part of Speech Tagging,3
08,Beyond Log-Linear Models: Boosted Minimum Error Rate Training for N-best Re-ranking,6
08,Coreference-inspired Coherence Modeling,6
08,Enforcing Transitivity in Coreference Resolution,15
08,Simulating the Behaviour of Older versus Younger Users when Interacting with Spoken Dialogue Systems,3
08,Active Sample Selection for Named Entity Transliteration,7
08,Four Techniques for Online Handling of Out-of-Vocabulary Words in Arabic-English Statistical Machine Translation,5
08,Combined One Sense Disambiguation of Abbreviations,2
08,Assessing the Costs of Sampling Methods in Active Learning for Annotation,7
08,Blog Categorization Exploiting Domain Dictionary and Dynamically Estimated Domains of Unknown Words,3
08,Mixture Model POMDPs for Efficient Handling of Uncertainty in Dialogue Management,9
08,Recent Improvements in the CMU Large Scale Chinese-English SMT System,2
08,Machine Translation System Combination using ITG-based Alignments,21
08,Dictionary Definitions based Homograph Identification using a Generative Hierarchical Model,0
08,A Novel Feature-based Approach to Chinese Entity Relation Extraction,5
08,Using Structural Information for Identifying Similar Chinese Characters,3
08,You've Got Answers: Towards Personalized Models for Predicting Success in Community Question Answering,6
08,Self-Training for Biomedical Parsing,11
08,A Unified Syntactic Model for Parsing Fluent and Disfluent Speech,3
08,"The Good, the Bad, and the Unknown: Morphosyllabic Sentiment Tagging of Unseen Words",2
08,Kernels on Linguistic Structures for Answer Extraction,9
08,"Arabic Morphological Tagging, Diacritization, and Lemmatization Using Lexeme Models and Feature Ranking",10
08,Using Automatically Transcribed Dialogs to Learn User Models in a Spoken Dialog System,3
08,Robust Extraction of Named Entity Including Unfamiliar Word,1
08,In-Browser Summarisation: Generating Elaborative Summaries Biased Towards the Reading Context,5
08,Lyric-based Song Sentiment Classification with Sentiment Vector Space Model,1
08,Mining Wikipedia Revision Histories for Improving Sentence Compression,1
08,Smoothing a Tera-word Language Model,2
08,Event Matching Using the Transitive Closure of Dependency Relations,2
08,A Linguistically Annotated Reordering Model for BTG-based Statistical Machine Translation,3
08,Segmentation for English-to-Arabic Statistical Machine Translation,5
08,Exploiting N-best Hypotheses for SMT Self-Enhancement,4
08,Partial Matching Strategy for Phrase-based Statistical Machine Translation,1
08,Unsupervised Learning of Acoustic Sub-word Units,2
08,High Frequency Word Entrainment in Spoken Dialogue,4
08,Distributed Listening: A Parallel Processing Approach to Automatic Speech Recognition,0
08,Learning Semantic Links from a Corpus of Parallel Temporal and Causal Relations,3
08,Evolving New Lexical Association Measures Using Genetic Programming,1
08,Semantic Types of Some Generic Relation Arguments: Detection and Evaluation,4
08,Mapping between Compositional Semantic Representations and Lexical Semantic Resources: Towards Accurate Deep Semantic Parsing,0
08,Query-based Sentence Fusion is Better Defined and Leads to More Preferred Results than Generic Sentence Fusion,3
08,Intrinsic vs. Extrinsic Evaluation Measures for Referring Expression Generation,14
08,Correlation between ROUGE and Human Evaluation of Extractive Meeting Summaries,5
08,FastSum: Fast and Accurate Query-based Multi-document Summarization,6
08,Construct State Modification in the Arabic Treebank,0
08,Unlexicalised Hidden Variable Models of Split Dependency Grammars,2
08,Computing Confidence Scores for All Sub Parse Trees,1
08,Adapting a WSJ-Trained Parser to Grammatically Noisy Text,2
08,Enriching Spoken Language Translation with Dialog Acts,3
08,Speakers' Intention Prediction Using Statistics of Multi-level Features in a Schedule Management Domain,0
08,Active Learning with Confidence,4
08,"splitSVM: Fast, Space-Efficient, non-Heuristic, Polynomial Kernel Computation for NLP Applications",4
08,Extracting a Representation from Text for Semantic Analysis,1
08,Efficient Processing of Underspecified Discourse Representations,3
08,Choosing Sense Distinctions for WSD: Psycholinguistic Evidence,0
08,Decompounding query keywords from compounding languages,2
08,Multi-domain Sentiment Classification,6
08,Evaluating Word Prediction: Framing Keystroke Savings,1
08,Pairwise Document Similarity in Large Collections with MapReduce,27
08,Text Segmentation with LDA-Based Fisher Kernel,2
08,A Supervised Learning Approach to Automatic Synonym Identification Based on Distributional Features,3
08,An Integraged Architecture for Generating Parenthetical Constructions,0
08,Inferring Activity Time in News through Event Modeling,1
08,Combining Source and Target Language Information for Name Tagging of Machine Translation Output,0
08,A Re-examination on Features in Regression Based Approach to Automatic MT Evaluation,0
08,The Role of Positive Feedback in Intelligent Tutoring Systems,4
08,Arabic Language Modeling with Finite State Transducers,2
08,Impact of Initiative on Collaborative Problem Solving,0
08,An Unsupervised Vector Approach to Biomedical Term Disambiguation: Integrating UMLS and Medline,3
08,A Subcategorization Acquisition System for French Verbs,1
08,Adaptive Language Modeling for Word Prediction,1
08,A Hierarchical Approach to Encoding Medical Concepts for Clinical Notes,0
08,Demonstration of a POMDP Voice Dialer,5
08,Generating Research Websites Using Summarisation Techniques,0
08,BART: A Modular Toolkit for Coreference Resolution,16
08,Demonstration of the UAM CorpusTool for Text and Image Annotation,0
08,Interactive ASR Error Correction for Touchscreen Devices,0
08,Yawat: Yet Another Word Alignment Tool,1
08,SIDE: The Summarization Integrated Development Environment,1
08,The QuALiM Question Answering Demo: Supplementing Answers with Paragraphs drawn from Wikipedia,4
08,Introduction to Computational Advertising,2
08,Building Practical Spoken Dialog Systems,0
08,Semi-Supervised Learning for Natural Language Processing,0
08,Advanced Online Learning for Natural Language Processing,0
08,Speech Technology: From Research to the Industry of Human-Machine Communication,0
08,Interactive Visualization for Computational Linguistics,2
09,Heterogeneous Transfer Learning for Image Clustering via the SocialWeb,4
09,Investigations on Word Senses and Word Usages,2
09,A Comparative Study on Generalization of Semantic Roles in FrameNet,4
09,Unsupervised Argument Identification for Semantic Role Labeling,2
09,"Brutus: A Semantic Role Labeling System Incorporating CCG, CFG, and Dependency Features",4
09,Exploiting Heterogeneous Treebanks for Parsing,1
09,Cross Language Dependency Parsing using a Bilingual Lexicon,0
09,Topological Field Parsing of German,1
09,Unsupervised Multilingual Grammar Induction,4
09,Reinforcement Learning for Mapping Instructions to Actions,9
09,Learning Semantic Correspondences with Less Supervision,10
09,Bayesian Unsupervised Word Segmentation with Nested Pitman-Yor Language Modeling,9
09,Knowing the Unseen: Estimating Vocabulary Size over Unseen Samples,1
09,A Ranking Approach to Stress Prediction for Letter-to-Phoneme Conversion,1
09,Reducing the Annotation Effort for Letter-to-Phoneme Conversion,1
09,Transliteration Alignment,9
09,"Automatic training of lemmatization rules that handle morphological changes in pre-, in- and suffixes alike",0
09,Revisiting Pivot Language Approach for Machine Translation,0
09,Efficient Minimum Error Rate Training and Minimum Bayes-Risk Decoding for Translation Hypergraphs and Lattices,7
09,Forest-based Tree Sequence to String Translation Model,3
09,Active Learning for Multilingual Statistical Machine Translation,2
09,DEPEVAL(summ): Dependency-based Evaluation for Automatic Summaries,2
09,Summarizing Definition from Wikipedia,3
09,Automatically Generating Wikipedia Articles: A Structure-Aware Approach,14
09,Learning to Tell Tales: A Data-driven Approach to Story Generation,1
09,Recognizing Stances in Online Debates,1
09,Co-Training for Cross-Lingual Sentiment Classification,17
09,A Non-negative Matrix Tri-factorization Approach to Sentiment Classification with Lexical Prior Knowledge,7
09,Discovering the Discriminative Views: Measuring Term Weights for Sentiment Analysis,5
09,"Compiling a Massive, Multilingual Dictionary via Probabilistic Inference",4
09,A Metric-based Framework for Automatic Taxonomy Induction,4
09,Learning with Annotation Noise,1
09,"Abstraction and Generalisation in Semantic Role Labels: PropBank, VerbNet or both?",2
09,Robust Machine Translation Evaluation with Entailment Features,4
09,The Contribution of Linguistic Features to Automatic Machine Translation Evaluation,0
09,A Syntax-Driven Bracketing Model for Phrase-Based Translation,2
09,Topological Ordering of Function Words in Hierarchical Phrase-based Translation,0
09,Phrase-Based Statistical Machine Translation as a Traveling Salesman Problem,0
09,Concise Integer Linear Programming Formulations for Dependency Parsing,15
09,Non-Projective Dependency Parsing in Expected Linear Time,3
09,Semi-supervised Learning of Dependency Parsers using Generalized Expectation Criteria,5
09,Dependency Grammar Induction via Bitext Projection Constraints,12
09,Cross-Domain Dependency Parsing Using a Deep Linguistic Grammar,2
09,A Chinese-English Organization Name Translation System Using Heuristic Web Mining and Asymmetric Alignment,1
09,Reducing Semantic Drift with Bagging and Distributional Similarity,2
09,Jointly Identifying Temporal Relations with Markov Logic,2
09,Profile Based Cross-Document Coreference Using Kernelized Fuzzy Relational Clustering,2
09,"Who, What, When, Where, Why? Comparing Multiple Approaches to the Cross-Lingual 5W Task",3
09,Bilingual Co-Training for Monolingual Hyponymy-Relation Acquisition,3
09,Automatic Set Instance Extraction using the Web,1
09,Extracting Lexical Reference Rules from Wikipedia,2
09,Employing Topic Models for Pattern-based Semantic Class Discovery,4
09,Paraphrase Identification as Probabilistic Quasi-Synchronous Recognition,8
09,Stochastic Gradient Descent Training for L1-regularized Log-linear Models with Cumulative Penalty,8
09,A global model for joint lemmatization and part-of-speech prediction,2
09,Distributional Representations for Handling Sparsity in Supervised Sequence-Labeling,4
09,Minimized Models for Unsupervised Part-of-Speech Tagging,4
09,An Error-Driven Word-Character Hybrid Model for Joint Chinese Word Segmentation and POS Tagging,6
09,Linefeed Insertion into Japanese Spoken Monologue for Captioning,2
09,Semi-supervised Learning for Automatic Prosodic Event Detection Using Co-training Algorithm,1
09,Summarizing multiple spoken documents: finding evidence from untranscribed audio,1
09,Improving Tree-to-Tree Translation with Packed Forests,6
09,Fast Consensus Decoding over Translation Forests,4
09,Joint Decoding with Multiple Translation Models,4
09,Collaborative Decoding: Partial Hypothesis Re-ranking Using Translation Consensus between Decoders,2
09,Variational Decoding for Statistical Machine Translation,10
09,Unsupervised Learning of Narrative Schemas and their Participants,4
09,Learning a Compositional Semantic Parser using an Existing Syntactic Parser,1
09,Latent Variable Models of Concept-Attribute Attachment,2
09,The Chinese Aspect Generation Based on Aspect Selection Functions,0
09,Quantitative modeling of the neural representation of adjective-noun phrases to account for fMRI activation,0
09,Capturing Salience with a Trainable Cache Model for Zero-anaphora Resolution,3
09,Conundrums in Noun Phrase Coreference Resolution: Making Sense of the State-of-the-Art,6
09,A Novel Discourse Parser Based on Support Vector Machine Classification,4
09,Genre distinctions for discourse in the Penn TreeBank,4
09,Automatic sense prediction for implicit discourse relations in text,9
09,A Framework of Feature Selection Methods for Text Categorization,6
09,"Mine the Easy, Classify the Hard: A Semi-Supervised Approach to Automatic Sentiment Classification",5
09,Modeling Latent Biographic Attributes in Conversational Genres,2
09,A Graph-based Semi-Supervised Learning for Question-Answering,2
09,Combining Lexical Semantic Resources with Question & Answer Archives for Translation-Based Answer Finding,2
09,Answering Opinion Questions with Random Walks on Graphs,6
09,What lies beneath: Semantic and syntactic analysis of manually reconstructed spontaneous speech,0
09,Discriminative Lexicon Adaptation for Improved Character Accuracy - A New Direction in Chinese Language Modeling,0
09,Improving Automatic Speech Recognition for Lectures through Transformation-based Rules Learned from Minimal Data,1
09,Quadratic-Time Dependency Parsing for Machine Translation,3
09,A Gibbs Sampler for Phrasal Synchronous Grammar Induction,4
09,Source-Language Entailment Modeling for Translating Unknown Terms,2
09,Case markers and Morphology: Addressing the crux of the fluency problem in English-Hindi SMT,1
09,Dependency Based Chinese Sentence Realization,0
09,Incorporating Information Status into Generation Ranking,2
09,A Syntax-Free Approach to Japanese Sentence Compression,1
09,Application-driven Statistical Paraphrase Generation,5
09,Semi-Supervised Cause Identification from Aviation Safety Reports,0
09,SMS based Interface for FAQ Retrieval,6
09,Semantic Tagging of Web Search Queries,2
09,Mining Bilingual Data from the Web with Adaptively Learnt Patterns,5
09,Comparing Objective and Subjective Measures of Usability in a Human-Robot Dialogue System,2
09,Setting Up User Action Probabilities in User Simulations for Dialog System Development,0
09,Dialogue Segmentation with Large Numbers of Volunteer Internet Annotators,0
09,Robust Approach to Abbreviating Terms: A Discriminative Latent Variable Model with Global Information,1
09,A non-contiguous Tree Sequence Alignment-based Model for Statistical Machine Translation,2
09,Better Word Alignments with Supervised ITG Models,10
09,Confidence Measure for Word Alignment,2
09,A Comparative Study of Hypothesis Alignment and its Improvement for Machine Translation System Combination,1
09,Incremental HMM Alignment for MT System Combination,4
09,K-Best A* Parsing,1
09,Coordinate Structure Analysis with Global Structural Constraints and Alignment-Based Local Features,0
09,Learning Context-Dependent Mappings from Sentences to Logical Form,9
09,An Optimal-Time Binarization Algorithm for Linear Context-Free Rewriting Systems with Fan-Out Two,3
09,A Polynomial-Time Parsing Algorithm for TT-MCTAG,5
